{
  "id": "ga4gh:SL.Lh4ivz9PI9DLGduOuQ6Fq8UI8CvamvtN",
  "type": "SequenceLocation",
  "name": null,
  "aliases": [],
  "description": "Sequence within refseq:NP_004110.2, the protein product of the MANE Select coding transcript for FLT3 (refseq:NM_004119.3), corresponding to Exon 8. This exon's protein location may share a codon boundary with the adjacent exon's protein location.",
  "digest": "Lh4ivz9PI9DLGduOuQ6Fq8UI8CvamvtN",
  "sequenceReference": {
    "id": "ga4gh:SQ.0dtDG7QKyvW7BntvQVpLS83mYRA58LKH",
    "type": "SequenceReference",
    "name": "NP_004110.2",
    "aliases": [
      "ensembl:ENSP00000241453.7",
      "ga4gh:SQ.0dtDG7QKyvW7BntvQVpLS83mYRA58LKH",
      "refseq:NP_004110.2"
    ],
    "description": "The protein product of the MANE Select coding transcript for FLT3 (refseq:NM_004119.3), corresponding to the Refseq protein accession NP_004110.2.",
    "moleculeType": "protein",
    "refgetAccession": "SQ.0dtDG7QKyvW7BntvQVpLS83mYRA58LKH",
    "residueAlphabet": "aa"
  },
  "start": 294,
  "end": 346,
  "sequence": null
}