{
  "id": "ga4gh:SL.uWfFK_zQSzi5W6IoQJUGJMuNiKcP2AiW",
  "type": "SequenceLocation",
  "name": null,
  "aliases": [],
  "description": "Sequence within refseq:NP_001365831.1, the protein product of the MANE Select coding transcript for ROS1 (refseq:NM_001378902.1), corresponding to Exon 30. This exon's protein location may share a codon boundary with the adjacent exon's protein location.",
  "digest": "uWfFK_zQSzi5W6IoQJUGJMuNiKcP2AiW",
  "sequenceReference": {
    "id": "ga4gh:SQ.22Sf5cMxU4cVHRP44TPGjT-lO17K4Dfc",
    "type": "SequenceReference",
    "name": "NP_001365831.1",
    "aliases": [
      "ensembl:ENSP00000357493.3",
      "ga4gh:SQ.22Sf5cMxU4cVHRP44TPGjT-lO17K4Dfc",
      "refseq:NP_001365831.1"
    ],
    "description": "The protein product of the MANE Select coding transcript for ROS1 (refseq:NM_001378902.1), corresponding to the Refseq protein accession NP_001365831.1.",
    "moleculeType": "protein",
    "refgetAccession": "SQ.22Sf5cMxU4cVHRP44TPGjT-lO17K4Dfc",
    "residueAlphabet": "aa"
  },
  "start": 1550,
  "end": 1628,
  "sequence": null
}