{
  "id": "ga4gh:SL.AymiymWHURAm3uiKmFFaWiLW1QyBANhF",
  "type": "SequenceLocation",
  "name": null,
  "aliases": [],
  "description": "Sequence within refseq:NM_000051.4, the MANE Select coding transcript for ATM, corresponding to Exon 4.",
  "digest": "AymiymWHURAm3uiKmFFaWiLW1QyBANhF",
  "sequenceReference": {
    "id": "ga4gh:SQ.XOHmaNgj4t4WeRzFBLzrbQG_pOe-qLOG",
    "type": "SequenceReference",
    "name": "NM_000051.4",
    "aliases": [
      "ga4gh:SQ.XOHmaNgj4t4WeRzFBLzrbQG_pOe-qLOG",
      "refseq:NM_000051.4"
    ],
    "description": "The MANE Select coding transcript for ATM, corresponding to the Refseq transcript accession NM_000051.4.",
    "moleculeType": "mRNA",
    "refgetAccession": "SQ.XOHmaNgj4t4WeRzFBLzrbQG_pOe-qLOG",
    "residueAlphabet": "na"
  },
  "start": 335,
  "end": 481,
  "sequence": null
}