{
  "id": "ga4gh:SL.wMfDfZ79tSRoYOVXLgve2dSr2QwkCdgz",
  "type": "SequenceLocation",
  "name": null,
  "aliases": [],
  "description": "Sequence within refseq:NP_004295.2, the protein product of the MANE Select coding transcript for ALK (refseq:NM_004304.5), corresponding to Exon 15. This exon's protein location may share a codon boundary with the adjacent exon's protein location.",
  "digest": "wMfDfZ79tSRoYOVXLgve2dSr2QwkCdgz",
  "sequenceReference": {
    "id": "ga4gh:SQ.q9CnK-HKWh9eqhOi8FlzR7M0pCmUrWPs",
    "type": "SequenceReference",
    "name": "NP_004295.2",
    "aliases": [
      "ensembl:ENSP00000373700.3",
      "ga4gh:SQ.q9CnK-HKWh9eqhOi8FlzR7M0pCmUrWPs",
      "refseq:NP_004295.2"
    ],
    "description": "The protein product of the MANE Select coding transcript for ALK (refseq:NM_004304.5), corresponding to the Refseq protein accession NP_004295.2.",
    "moleculeType": "protein",
    "refgetAccession": "SQ.q9CnK-HKWh9eqhOi8FlzR7M0pCmUrWPs",
    "residueAlphabet": "aa"
  },
  "start": 829,
  "end": 878,
  "sequence": null
}