{
  "id": "ga4gh:SL.1QfgR9A8fzzDcBuF-1RJDE72LGCFj60I",
  "type": "SequenceLocation",
  "name": null,
  "aliases": [],
  "description": "Sequence within refseq:NP_001073981.1, the protein product of the MANE Select coding transcript for BICC1 (refseq:NM_001080512.3), corresponding to Exon 5.",
  "digest": "1QfgR9A8fzzDcBuF-1RJDE72LGCFj60I",
  "sequenceReference": {
    "id": "ga4gh:SQ._qQYOQ9IvNnke24f0-wy6ipO_dSY-aiD",
    "type": "SequenceReference",
    "name": "NP_001073981.1",
    "aliases": [
      "ensembl:ENSP00000362993.3",
      "ga4gh:SQ._qQYOQ9IvNnke24f0-wy6ipO_dSY-aiD",
      "refseq:NP_001073981.1"
    ],
    "description": "The protein product of the MANE Select coding transcript for BICC1 (refseq:NM_001080512.3), corresponding to the Refseq protein accession NP_001073981.1.",
    "moleculeType": "protein",
    "refgetAccession": "SQ._qQYOQ9IvNnke24f0-wy6ipO_dSY-aiD",
    "residueAlphabet": "aa"
  },
  "start": 129,
  "end": 182,
  "sequence": null
}