{
  "id": "ga4gh:SL.blsYDimr6npxDY98UGDXLJHq-NWXY4hC",
  "type": "SequenceLocation",
  "name": null,
  "aliases": [],
  "description": "Sequence within refseq:NP_000456.2, the protein product of the MANE Select coding transcript for BARD1 (refseq:NM_000465.4), corresponding to Exon 1. This exon's protein location may share a codon boundary with the adjacent exon's protein location.",
  "digest": "blsYDimr6npxDY98UGDXLJHq-NWXY4hC",
  "sequenceReference": {
    "id": "ga4gh:SQ.FHplLz13mAowCHRpfupULtsf4wMG2F0v",
    "type": "SequenceReference",
    "name": "NP_000456.2",
    "aliases": [
      "ensembl:ENSP00000260947.4",
      "ga4gh:SQ.FHplLz13mAowCHRpfupULtsf4wMG2F0v",
      "refseq:NP_000456.2"
    ],
    "description": "The protein product of the MANE Select coding transcript for BARD1 (refseq:NM_000465.4), corresponding to the Refseq protein accession NP_000456.2.",
    "moleculeType": "protein",
    "refgetAccession": "SQ.FHplLz13mAowCHRpfupULtsf4wMG2F0v",
    "residueAlphabet": "aa"
  },
  "start": 0,
  "end": 53,
  "sequence": null
}