{
  "id": "ga4gh:SL.QTK-WZWUSrNDxpvsD45KgNiaDXIetFZK",
  "type": "SequenceLocation",
  "name": null,
  "aliases": [],
  "description": "Sequence within refseq:NM_004327.4, the MANE Select coding transcript for BCR, corresponding to Exon 17.",
  "digest": "QTK-WZWUSrNDxpvsD45KgNiaDXIetFZK",
  "sequenceReference": {
    "id": "ga4gh:SQ.kpytJsXw3BwLC3oBSjHQS1kwxs4WO3I3",
    "type": "SequenceReference",
    "name": "NM_004327.4",
    "aliases": [
      "ensembl:ENST00000305877.13",
      "ga4gh:SQ.kpytJsXw3BwLC3oBSjHQS1kwxs4WO3I3",
      "refseq:NM_004327.4"
    ],
    "description": "The MANE Select coding transcript for BCR, corresponding to the Refseq transcript accession NM_004327.4.",
    "moleculeType": "mRNA",
    "refgetAccession": "SQ.kpytJsXw3BwLC3oBSjHQS1kwxs4WO3I3",
    "residueAlphabet": "na"
  },
  "start": 3464,
  "end": 3524,
  "sequence": null
}