{
  "id": "ga4gh:SL.dmYjH2VJr352a3ZxdkEpW51gv2hFXVAu",
  "type": "SequenceLocation",
  "name": null,
  "aliases": [],
  "description": "Sequence within refseq:NP_075598.2, the protein product of the MANE Select coding transcript for FGFR1 (refseq:NM_023110.3), corresponding to Exon 18.",
  "digest": "dmYjH2VJr352a3ZxdkEpW51gv2hFXVAu",
  "sequenceReference": {
    "id": "ga4gh:SQ.fgaUDXKfU18Tt8FUC5-BeWqLIEhEdMZ-",
    "type": "SequenceReference",
    "name": "NP_075598.2",
    "aliases": [
      "ensembl:ENSP00000400162.2",
      "ga4gh:SQ.fgaUDXKfU18Tt8FUC5-BeWqLIEhEdMZ-",
      "refseq:NP_075598.2"
    ],
    "description": "The protein product of the MANE Select coding transcript for FGFR1 (refseq:NM_023110.3), corresponding to the Refseq protein accession NP_075598.2.",
    "moleculeType": "protein",
    "refgetAccession": "SQ.fgaUDXKfU18Tt8FUC5-BeWqLIEhEdMZ-",
    "residueAlphabet": "aa"
  },
  "start": 764,
  "end": 822,
  "sequence": null
}