{
  "id": "ga4gh:SL.3Yyid_s8qUGnUzdLWeWjWpLT_1TTl-tD",
  "type": "SequenceLocation",
  "name": null,
  "aliases": [],
  "description": "Sequence within refseq:NP_000042.3, the protein product of the MANE Select coding transcript for ATM (refseq:NM_000051.4), corresponding to Exon 8. This exon's protein location may share a codon boundary with the adjacent exon's protein location.",
  "digest": "3Yyid_s8qUGnUzdLWeWjWpLT_1TTl-tD",
  "sequenceReference": {
    "id": "ga4gh:SQ.6k1y4bTo7pEJ-a1GaniRBaCJXXGkBGFO",
    "type": "SequenceReference",
    "name": "NP_000042.3",
    "aliases": [
      "ensembl:ENSP00000278616.4",
      "ga4gh:SQ.6k1y4bTo7pEJ-a1GaniRBaCJXXGkBGFO",
      "refseq:NP_000042.3"
    ],
    "description": "The protein product of the MANE Select coding transcript for ATM (refseq:NM_000051.4), corresponding to the Refseq protein accession NP_000042.3.",
    "moleculeType": "protein",
    "refgetAccession": "SQ.6k1y4bTo7pEJ-a1GaniRBaCJXXGkBGFO",
    "residueAlphabet": "aa"
  },
  "start": 300,
  "end": 355,
  "sequence": null
}