{
  "id": "ga4gh:SL.SZJQHxsheey3jCU8R4e9h2kW14Ki6Juu",
  "type": "SequenceLocation",
  "name": null,
  "aliases": [],
  "description": "Sequence within refseq:NP_000050.3, the protein product of the MANE Select coding transcript for BRCA2 (refseq:NM_000059.4), corresponding to Exon 26.",
  "digest": "SZJQHxsheey3jCU8R4e9h2kW14Ki6Juu",
  "sequenceReference": {
    "id": "ga4gh:SQ.A6rzuv6kdsuIp6gy6fykzgzyJe9NJOC9",
    "type": "SequenceReference",
    "name": "NP_000050.3",
    "aliases": [
      "ensembl:ENSP00000369497.3",
      "ga4gh:SQ.A6rzuv6kdsuIp6gy6fykzgzyJe9NJOC9",
      "refseq:NP_000050.3"
    ],
    "description": "The protein product of the MANE Select coding transcript for BRCA2 (refseq:NM_000059.4), corresponding to the Refseq protein accession NP_000050.3.",
    "moleculeType": "protein",
    "refgetAccession": "SQ.A6rzuv6kdsuIp6gy6fykzgzyJe9NJOC9",
    "residueAlphabet": "aa"
  },
  "start": 3167,
  "end": 3216,
  "sequence": null
}