{
  "id": "ga4gh:SL.0yTzdHkVxvxwVXgahyllpsou3QjkThd4",
  "type": "SequenceLocation",
  "name": null,
  "aliases": [],
  "description": "Sequence within refseq:NP_112179.2, the protein product of the MANE Select coding transcript for FIP1L1 (refseq:NM_030917.4), corresponding to Exon 8. This exon's protein location may share a codon boundary with the adjacent exon's protein location.",
  "digest": "0yTzdHkVxvxwVXgahyllpsou3QjkThd4",
  "sequenceReference": {
    "id": "ga4gh:SQ.l_Fbxn4URDKhZEq4FkZCL_kL7yqbsKjL",
    "type": "SequenceReference",
    "name": "NP_112179.2",
    "aliases": [
      "ensembl:ENSP00000336752.6",
      "ga4gh:SQ.l_Fbxn4URDKhZEq4FkZCL_kL7yqbsKjL",
      "refseq:NP_112179.2"
    ],
    "description": "The protein product of the MANE Select coding transcript for FIP1L1 (refseq:NM_030917.4), corresponding to the Refseq protein accession NP_112179.2.",
    "moleculeType": "protein",
    "refgetAccession": "SQ.l_Fbxn4URDKhZEq4FkZCL_kL7yqbsKjL",
    "residueAlphabet": "aa"
  },
  "start": 168,
  "end": 212,
  "sequence": null
}