{
  "id": "ga4gh:SL.LAu3Yx5-C9NGEhzFqKKQ3CupAOmk9wMU",
  "type": "SequenceLocation",
  "name": null,
  "aliases": [],
  "description": "Sequence within refseq:NP_005887.2, the protein product of the MANE Select coding transcript for IDH1 (refseq:NM_005896.4), corresponding to Exon 3. This exon's protein location may share a codon boundary with the adjacent exon's protein location.",
  "digest": "LAu3Yx5-C9NGEhzFqKKQ3CupAOmk9wMU",
  "sequenceReference": {
    "id": "ga4gh:SQ.VZMxTY2iB2G_EuwlpVZ0AnX6R-am08GZ",
    "type": "SequenceReference",
    "name": "NP_005887.2",
    "aliases": [
      "ensembl:ENSP00000260985.2",
      "ga4gh:SQ.VZMxTY2iB2G_EuwlpVZ0AnX6R-am08GZ",
      "refseq:NP_005887.2"
    ],
    "description": "The protein product of the MANE Select coding transcript for IDH1 (refseq:NM_005896.4), corresponding to the Refseq protein accession NP_005887.2.",
    "moleculeType": "protein",
    "refgetAccession": "SQ.VZMxTY2iB2G_EuwlpVZ0AnX6R-am08GZ",
    "residueAlphabet": "aa"
  },
  "start": 0,
  "end": 41,
  "sequence": null
}