{
  "id": "ga4gh:SL.gyhCM2MFxeFc9EPkoAtBvOhy1MGnKGqn",
  "type": "SequenceLocation",
  "name": null,
  "aliases": [],
  "description": "Sequence spanning the length of refseq:NM_013964.5, the MANE Select coding transcript for NRG1.",
  "digest": "gyhCM2MFxeFc9EPkoAtBvOhy1MGnKGqn",
  "sequenceReference": {
    "id": "ga4gh:SQ.OPVeJm9T3KcdeHmV_EI5RbIhnEnLm2O4",
    "type": "SequenceReference",
    "name": "NM_013964.5",
    "aliases": [
      "ga4gh:SQ.OPVeJm9T3KcdeHmV_EI5RbIhnEnLm2O4",
      "refseq:NM_013964.5"
    ],
    "description": "The MANE Select coding transcript for NRG1, corresponding to the Refseq transcript accession NM_013964.5.",
    "moleculeType": "mRNA",
    "refgetAccession": "SQ.OPVeJm9T3KcdeHmV_EI5RbIhnEnLm2O4",
    "residueAlphabet": "na"
  },
  "start": 0,
  "end": 11983,
  "sequence": null
}