{
  "id": "ga4gh:SL.weJjqdxQd0V9YpVFidaRZx-JTzpxbfMj",
  "type": "SequenceLocation",
  "name": null,
  "aliases": [],
  "description": "Sequence within refseq:NP_006209.2, the protein product of the MANE Select coding transcript for PIK3CA (refseq:NM_006218.4), corresponding to Exon 19. This exon's protein location may share a codon boundary with the adjacent exon's protein location.",
  "digest": "weJjqdxQd0V9YpVFidaRZx-JTzpxbfMj",
  "sequenceReference": {
    "id": "ga4gh:SQ.km8C9FORJbErpAh7Ub63pZLUzEm-au9D",
    "type": "SequenceReference",
    "name": "NP_006209.2",
    "aliases": [
      "ensembl:ENSP00000263967.3",
      "ga4gh:SQ.km8C9FORJbErpAh7Ub63pZLUzEm-au9D",
      "refseq:NP_006209.2"
    ],
    "description": "The protein product of the MANE Select coding transcript for PIK3CA (refseq:NM_006218.4), corresponding to the Refseq protein accession NP_006209.2.",
    "moleculeType": "protein",
    "refgetAccession": "SQ.km8C9FORJbErpAh7Ub63pZLUzEm-au9D",
    "residueAlphabet": "aa"
  },
  "start": 888,
  "end": 928,
  "sequence": null
}