{
  "id": "ga4gh:SL.1ZWJnKt_UlGqtFbWds59xxNiYWbqEY9T",
  "type": "SequenceLocation",
  "name": null,
  "aliases": [],
  "description": "Sequence within refseq:NP_001184033.1, the protein product of the MANE Select coding transcript for KMT2A (refseq:NM_001197104.2), corresponding to Exon 28. This exon's protein location shares a codon boundary with the adjacent exons on both sides.",
  "digest": "1ZWJnKt_UlGqtFbWds59xxNiYWbqEY9T",
  "sequenceReference": {
    "id": "ga4gh:SQ.AxiFiHR1KWySlGgSpw28vKBbBXfXEKcq",
    "type": "SequenceReference",
    "name": "NP_001184033.1",
    "aliases": [
      "ensembl:ENSP00000436786.1",
      "ga4gh:SQ.AxiFiHR1KWySlGgSpw28vKBbBXfXEKcq",
      "refseq:NP_001184033.1"
    ],
    "description": "The protein product of the MANE Select coding transcript for KMT2A (refseq:NM_001197104.2), corresponding to the Refseq protein accession NP_001184033.1.",
    "moleculeType": "protein",
    "refgetAccession": "SQ.AxiFiHR1KWySlGgSpw28vKBbBXfXEKcq",
    "residueAlphabet": "aa"
  },
  "start": 3584,
  "end": 3612,
  "sequence": null
}