{
  "id": "ga4gh:SL.Ne7JO0zFytoMvuN9c2WJTYWTyfzhBLXi",
  "type": "SequenceLocation",
  "name": null,
  "aliases": [],
  "description": "Sequence spanning the length of refseq:NM_002168.4, the MANE Select coding transcript for IDH2.",
  "digest": "Ne7JO0zFytoMvuN9c2WJTYWTyfzhBLXi",
  "sequenceReference": {
    "id": "ga4gh:SQ.kirLjhm3sLodOO90EOQJ9e41ZMcln-Q6",
    "type": "SequenceReference",
    "name": "NM_002168.4",
    "aliases": [
      "ga4gh:SQ.kirLjhm3sLodOO90EOQJ9e41ZMcln-Q6",
      "refseq:NM_002168.4"
    ],
    "description": "The MANE Select coding transcript for IDH2, corresponding to the Refseq transcript accession NM_002168.4.",
    "moleculeType": "mRNA",
    "refgetAccession": "SQ.kirLjhm3sLodOO90EOQJ9e41ZMcln-Q6",
    "residueAlphabet": "na"
  },
  "start": 0,
  "end": 2658,
  "sequence": null
}