{
  "id": "ga4gh:SL.VvxtKHfg97EU8GhA19ohjVa484O3i_he",
  "type": "SequenceLocation",
  "name": null,
  "aliases": [],
  "description": "Sequence within refseq:NP_005582.1, the protein product of the MANE Select coding transcript for MRE11 (refseq:NM_005591.4), corresponding to Exon 8. This exon's protein location shares a codon boundary with the adjacent exons on both sides.",
  "digest": "VvxtKHfg97EU8GhA19ohjVa484O3i_he",
  "sequenceReference": {
    "id": "ga4gh:SQ.38K-KnPP6NQiu2DBp511BJVGW-kodzxW",
    "type": "SequenceReference",
    "name": "NP_005582.1",
    "aliases": [
      "ensembl:ENSP00000325863.3",
      "ga4gh:SQ.38K-KnPP6NQiu2DBp511BJVGW-kodzxW",
      "refseq:NP_005582.1"
    ],
    "description": "The protein product of the MANE Select coding transcript for MRE11 (refseq:NM_005591.4), corresponding to the Refseq protein accession NP_005582.1.",
    "moleculeType": "protein",
    "refgetAccession": "SQ.38K-KnPP6NQiu2DBp511BJVGW-kodzxW",
    "residueAlphabet": "aa"
  },
  "start": 219,
  "end": 282,
  "sequence": null
}