{
  "id": "ga4gh:SL.qjXrBOZkuGVo7s7XxqL_95Cz5lKUJYMD",
  "type": "SequenceLocation",
  "name": null,
  "aliases": [],
  "description": "Sequence within refseq:NM_057091.3, the MANE Select coding transcript for NBN, corresponding to Exon 1.",
  "digest": "qjXrBOZkuGVo7s7XxqL_95Cz5lKUJYMD",
  "sequenceReference": {
    "id": "ga4gh:SQ.EKPoUVT6-4jjrWBzGGKMGEYxc2bkajSc",
    "type": "SequenceReference",
    "name": "NM_057091.3",
    "aliases": [
      "ensembl:ENST00000372359.10",
      "ga4gh:SQ.EKPoUVT6-4jjrWBzGGKMGEYxc2bkajSc",
      "refseq:NM_057091.3"
    ],
    "description": "The MANE Select coding transcript for NBN, corresponding to the Refseq transcript accession NM_057091.3.",
    "moleculeType": "mRNA",
    "refgetAccession": "SQ.EKPoUVT6-4jjrWBzGGKMGEYxc2bkajSc",
    "residueAlphabet": "na"
  },
  "start": 0,
  "end": 85,
  "sequence": null
}