{
  "id": "ga4gh:SL.5nmqCqFD-sKI5lFRHOfbFIg7Arrk3lW3",
  "type": "SequenceLocation",
  "name": null,
  "aliases": [],
  "description": "Sequence within refseq:NM_000142.5, the MANE Select coding transcript for FGFR3, corresponding to Exon 13.",
  "digest": "5nmqCqFD-sKI5lFRHOfbFIg7Arrk3lW3",
  "sequenceReference": {
    "id": "ga4gh:SQ.K_-bl-z6BuaqSy_vjZyjunOVEMoYG7VX",
    "type": "SequenceReference",
    "name": "NM_000142.5",
    "aliases": [
      "ga4gh:SQ.K_-bl-z6BuaqSy_vjZyjunOVEMoYG7VX",
      "refseq:NM_000142.5"
    ],
    "description": "The MANE Select coding transcript for FGFR3, corresponding to the Refseq transcript accession NM_000142.5.",
    "moleculeType": "mRNA",
    "refgetAccession": "SQ.K_-bl-z6BuaqSy_vjZyjunOVEMoYG7VX",
    "residueAlphabet": "na"
  },
  "start": 1920,
  "end": 2111,
  "sequence": null
}