{
  "id": "ga4gh:SL.qejOzbeORizxJQg1x_lidIaLTnb1wscQ",
  "type": "SequenceLocation",
  "name": null,
  "aliases": [],
  "description": "Sequence within refseq:NP_006197.1, the protein product of the MANE Select coding transcript for PDGFRA (refseq:NM_006206.6), corresponding to Exon 23. This exon's protein location may share a codon boundary with the adjacent exon's protein location.",
  "digest": "qejOzbeORizxJQg1x_lidIaLTnb1wscQ",
  "sequenceReference": {
    "id": "ga4gh:SQ.XpQn9sZLGv_GU3uiWO7YHq9-_alGjrVX",
    "type": "SequenceReference",
    "name": "NP_006197.1",
    "aliases": [
      "ensembl:ENSP00000257290.5",
      "ga4gh:SQ.XpQn9sZLGv_GU3uiWO7YHq9-_alGjrVX",
      "refseq:NP_006197.1"
    ],
    "description": "The protein product of the MANE Select coding transcript for PDGFRA (refseq:NM_006206.6), corresponding to the Refseq protein accession NP_006197.1.",
    "moleculeType": "protein",
    "refgetAccession": "SQ.XpQn9sZLGv_GU3uiWO7YHq9-_alGjrVX",
    "residueAlphabet": "aa"
  },
  "start": 1040,
  "end": 1089,
  "sequence": null
}