{
  "id": "ga4gh:SL.soqw498ekHIRmfkqU2OkjWO5F3jaIWQX",
  "type": "SequenceLocation",
  "name": null,
  "aliases": [],
  "description": "Sequence within refseq:NP_002098.1, the protein product of the MANE Select coding transcript for H3-3A (refseq:NM_002107.7), corresponding to Exon 4.",
  "digest": "soqw498ekHIRmfkqU2OkjWO5F3jaIWQX",
  "sequenceReference": {
    "id": "ga4gh:SQ.2uEiKlgt3rV_axllFiEObLHYBOl2mT38",
    "type": "SequenceReference",
    "name": "NP_002098.1",
    "aliases": [
      "ensembl:ENSP00000254810.3",
      "ga4gh:SQ.2uEiKlgt3rV_axllFiEObLHYBOl2mT38",
      "refseq:NP_002098.1"
    ],
    "description": "The protein product of the MANE Select coding transcript for H3-3A (refseq:NM_002107.7), corresponding to the Refseq protein accession NP_002098.1.",
    "moleculeType": "protein",
    "refgetAccession": "SQ.2uEiKlgt3rV_axllFiEObLHYBOl2mT38",
    "residueAlphabet": "aa"
  },
  "start": 94,
  "end": 136,
  "sequence": null
}