{
  "id": "ga4gh:SL.U-rY-staaPS0RvlPe1QYNGut1EEwyRuk",
  "type": "SequenceLocation",
  "name": null,
  "aliases": [],
  "description": "Sequence within refseq:NM_007294.4, the MANE Select coding transcript for BRCA1, corresponding to Exon 11.",
  "digest": "U-rY-staaPS0RvlPe1QYNGut1EEwyRuk",
  "sequenceReference": {
    "id": "ga4gh:SQ.oR9jzdHf6J23TozeyuvTXtwlm6PpUHHl",
    "type": "SequenceReference",
    "name": "NM_007294.4",
    "aliases": [
      "ensembl:ENST00000357654.9",
      "ga4gh:SQ.oR9jzdHf6J23TozeyuvTXtwlm6PpUHHl",
      "refseq:NM_007294.4"
    ],
    "description": "The MANE Select coding transcript for BRCA1, corresponding to the Refseq transcript accession NM_007294.4.",
    "moleculeType": "mRNA",
    "refgetAccession": "SQ.oR9jzdHf6J23TozeyuvTXtwlm6PpUHHl",
    "residueAlphabet": "na"
  },
  "start": 4209,
  "end": 4298,
  "sequence": null
}