{
  "id": "ga4gh:SL.dvZQG2wGmOwthzM06C-ySBxeVckRI2NE",
  "type": "SequenceLocation",
  "name": null,
  "aliases": [],
  "description": "Sequence within refseq:NP_004976.2, the protein product of the MANE Select coding transcript for KRAS (refseq:NM_004985.5), corresponding to Exon 5.",
  "digest": "dvZQG2wGmOwthzM06C-ySBxeVckRI2NE",
  "sequenceReference": {
    "id": "ga4gh:SQ.fytWhQSNGnA-86vDiQCxTSzgkk_WfQRS",
    "type": "SequenceReference",
    "name": "NP_004976.2",
    "aliases": [
      "ensembl:ENSP00000308495.3",
      "ga4gh:SQ.fytWhQSNGnA-86vDiQCxTSzgkk_WfQRS",
      "refseq:NP_004976.2"
    ],
    "description": "The protein product of the MANE Select coding transcript for KRAS (refseq:NM_004985.5), corresponding to the Refseq protein accession NP_004976.2.",
    "moleculeType": "protein",
    "refgetAccession": "SQ.fytWhQSNGnA-86vDiQCxTSzgkk_WfQRS",
    "residueAlphabet": "aa"
  },
  "start": 150,
  "end": 188,
  "sequence": null
}