{
  "id": "ga4gh:SL.SjoeLK9uKFdQhNbKDDdjDfUy9mWZ4jT7",
  "type": "SequenceLocation",
  "name": null,
  "aliases": [],
  "description": "Sequence within refseq:NP_001175.2, the protein product of the MANE Select coding transcript for ATR (refseq:NM_001184.4), corresponding to Exon 31. This exon's protein location shares a codon boundary with the adjacent exons on both sides.",
  "digest": "SjoeLK9uKFdQhNbKDDdjDfUy9mWZ4jT7",
  "sequenceReference": {
    "id": "ga4gh:SQ.u5Gzhlhn3KDy6pYiIe9mcVKXFMualGBl",
    "type": "SequenceReference",
    "name": "NP_001175.2",
    "aliases": [
      "ensembl:ENSP00000343741.4",
      "ga4gh:SQ.u5Gzhlhn3KDy6pYiIe9mcVKXFMualGBl",
      "refseq:NP_001175.2"
    ],
    "description": "The protein product of the MANE Select coding transcript for ATR (refseq:NM_001184.4), corresponding to the Refseq protein accession NP_001175.2.",
    "moleculeType": "protein",
    "refgetAccession": "SQ.u5Gzhlhn3KDy6pYiIe9mcVKXFMualGBl",
    "residueAlphabet": "aa"
  },
  "start": 1762,
  "end": 1794,
  "sequence": null
}